{
  "order_id": "xxxxxxxxxxxxxxxxxxxxxxxxxxxxxxxxxxxxxxxxxxxxxxxxxxxxxxxxxxxxxxxx",
  "from_status": "xxxxxxxxxxxxxxxxxxxxxxxxxxxxxxxx",
  "to_status": "xxxxxxxxxxxxxxxxxxxxxxxxxxxxxxxx",
  "reason_code": "xxxxxxxxxxxxxxxxxxxxxxxxxxxxxxxxxxxxxxxxxxxxxxxxxxxxxxxxxxxxxxxxxxxxxxxxxxxxxxxxxxxxxxxxxxxxxxxxxxxxxxxxxxxxxxxxxxxxxxxxxxxxxxxx",
  "cum_quantity": 0,
  "leaves_quantity": 100,
  "changed_at": "2026-07-02T02:00:00Z",
  "broker_order_id": "broker-order-1",
  "average_price": "10.01000000",
  "source_report_id": "report-1"
}
